{
  "schema_version": "apf.pattern-candidate/1.0",
  "pattern_id": "apf.public.candidate-not-asset",
  "version": "0.1.0",
  "title": "Candidate Not Asset",
  "intent": "Keep reviewed candidates distinct from owned or production assets.",
  "problem": "Without separate status types prohibit candidate-to-owned coercion, the system can accept an outcome that is not justified by the candidate not asset contract.",
  "context": "This pattern addresses learning outputs await rights and quality review; its concrete control is separate status types prohibit candidate-to-owned coercion.",
  "forces": [
    "Correctness requires that review approval does not establish ownership",
    "Operational pressure can cause: generic strings bypass typed status checks"
  ],
  "solution": "Implement separate status types prohibit candidate-to-owned coercion. Verify the anchored symbol `AssetPromotionDenied` with `test_asset_must_advance_sequentially` before reuse.",
  "invariants": [
    "review approval does not establish ownership",
    "registry accepts only declared promotion outcomes"
  ],
  "failure_modes": [
    "generic strings bypass typed status checks",
    "UI labels imply ownership absent legal evidence"
  ],
  "security": "The security boundary specifically rejects `generic strings bypass typed status checks` and fails closed if the candidate not asset evidence cannot be verified.",
  "privacy": "For candidate not asset, persist only its decision identifiers and digests; exclude payload data unrelated to separate status types prohibit candidate-to-owned coercion.",
  "license_provenance": {
    "license": "INTERNAL_PROPRIETARY",
    "origin": "ARKAON_IMPLEMENTED_INTERNAL",
    "external_material_included": false
  },
  "evidence_hashes": {
    "src/apf/asset_registry.py": "ef62a9f9dd35f212c2aef3036f133a92be6762399f2b0b853ddf84983b205bf4",
    "tests/test_asset_registry.py": "855e2553f7f9380d0707b4c2569bc4828fc92c1b1504bcc2d8619333e5dfdd23"
  },
  "source_refs": [
    "src/apf/asset_registry.py"
  ],
  "test_refs": [
    "tests/test_asset_registry.py"
  ],
  "verification_test_ids": [
    "tests/test_asset_registry.py::test_asset_must_advance_sequentially"
  ],
  "reuse_constraints": [
    "Confirm the target still requires: learning outputs await rights and quality review",
    "Do not apply when: the artifact was authored and registered through the owned-asset process",
    "External Ethernian promotion signature remains mandatory"
  ],
  "applies_when": "learning outputs await rights and quality review",
  "not_when": "the artifact was authored and registered through the owned-asset process",
  "evidence_anchors": {
    "source_symbol": "AssetPromotionDenied",
    "test_name": "test_asset_must_advance_sequentially"
  },
  "status": "ETHERNIAN_REVIEW_REQUIRED",
  "owned_asset": false,
  "semantic_fingerprint": "8c15e17abdbebf0d02753ebca0eeb61eafcc5fe7232797f6ad6ed34318892a80",
  "package_hash": "b0350acb3e1cdde8829845b202cd08f62809269bd9d001ce5cefe699ae86d413"
}
