{
  "schema_version": "apf.pattern-candidate/1.0",
  "pattern_id": "apf.public.optimistic-version-guard",
  "version": "0.1.0",
  "title": "Optimistic Version Guard",
  "intent": "Reject stale writers before they overwrite newer durable state.",
  "problem": "Without compare-and-swap rejects an unexpected aggregate version, the system can accept an outcome that is not justified by the optimistic version guard contract.",
  "context": "This pattern addresses concurrent reviewers update one aggregate; its concrete control is compare-and-swap rejects an unexpected aggregate version.",
  "forces": [
    "Correctness requires that each successful mutation increments once",
    "Operational pressure can cause: two writers share the same accepted version"
  ],
  "solution": "Implement compare-and-swap rejects an unexpected aggregate version. Verify the anchored symbol `DurableStoreError` with `test_persists_and_reopens_without_raw_material` before reuse.",
  "invariants": [
    "each successful mutation increments once",
    "stale expected versions produce no write"
  ],
  "failure_modes": [
    "two writers share the same accepted version",
    "retry code hides a genuine conflict"
  ],
  "security": "The security boundary specifically rejects `two writers share the same accepted version` and fails closed if the optimistic version guard evidence cannot be verified.",
  "privacy": "For optimistic version guard, persist only its decision identifiers and digests; exclude payload data unrelated to compare-and-swap rejects an unexpected aggregate version.",
  "license_provenance": {
    "license": "INTERNAL_PROPRIETARY",
    "origin": "ARKAON_IMPLEMENTED_INTERNAL",
    "external_material_included": false
  },
  "evidence_hashes": {
    "src/apf/durable_review.py": "358bd9b320e0a2c856c525ac4f478be5f8227331524887a7a7981c354d8df2c5",
    "tests/test_durable_review.py": "604132b276b2ca308b7347824c26f41e21c1c94bbeb9b414923d0b9fd11179c8"
  },
  "source_refs": [
    "src/apf/durable_review.py"
  ],
  "test_refs": [
    "tests/test_durable_review.py"
  ],
  "verification_test_ids": [
    "tests/test_durable_review.py::test_persists_and_reopens_without_raw_material"
  ],
  "reuse_constraints": [
    "Confirm the target still requires: concurrent reviewers update one aggregate",
    "Do not apply when: the database operation is append-only and commutative",
    "External Ethernian promotion signature remains mandatory"
  ],
  "applies_when": "concurrent reviewers update one aggregate",
  "not_when": "the database operation is append-only and commutative",
  "evidence_anchors": {
    "source_symbol": "DurableStoreError",
    "test_name": "test_persists_and_reopens_without_raw_material"
  },
  "status": "ETHERNIAN_REVIEW_REQUIRED",
  "owned_asset": false,
  "semantic_fingerprint": "869a3d1900818e9b5d28c6d6dbd45e11099ab241f6050fb74e1c36af198bb948",
  "package_hash": "1a574ebb0091c5b5bf0db8cbe96893e2e55223e0ec6ba2de8aad86549721e163"
}
