{
  "schema_version": "apf.pattern-candidate/1.0",
  "pattern_id": "apf.public.hash-chained-ledger",
  "version": "0.1.0",
  "title": "Hash-chained Audit Ledger",
  "intent": "Make ordered audit history tamper-evident with predecessor-bound hashes.",
  "problem": "Without each entry hashes canonical content plus predecessor hash, the system can accept an outcome that is not justified by the hash-chained audit ledger contract.",
  "context": "This pattern addresses audit ordering must reveal tampering; its concrete control is each entry hashes canonical content plus predecessor hash.",
  "forces": [
    "Correctness requires that entry order is cryptographically committed",
    "Operational pressure can cause: history rows are edited without recomputing descendants"
  ],
  "solution": "Implement each entry hashes canonical content plus predecessor hash. Verify the anchored symbol `OrchestratorStorageError` with `test_task_contract_canonical_round_trip` before reuse.",
  "invariants": [
    "entry order is cryptographically committed",
    "chain verification starts from a defined genesis"
  ],
  "failure_modes": [
    "history rows are edited without recomputing descendants",
    "canonicalization differs across readers"
  ],
  "security": "The security boundary specifically rejects `history rows are edited without recomputing descendants` and fails closed if the hash-chained audit ledger evidence cannot be verified.",
  "privacy": "For hash-chained audit ledger, persist only its decision identifiers and digests; exclude payload data unrelated to each entry hashes canonical content plus predecessor hash.",
  "license_provenance": {
    "license": "INTERNAL_PROPRIETARY",
    "origin": "ARKAON_IMPLEMENTED_INTERNAL",
    "external_material_included": false
  },
  "evidence_hashes": {
    "src/apf/orchestrator_storage.py": "39845efed553ad57029af65c36479fc9c93e3f91bfe684ac21f68fd552fdda3a",
    "tests/test_orchestrator_storage.py": "91ef65145cc6ae5ac5e38cb131241d56bbd942965d16897b90aff1b3b95f1a30"
  },
  "source_refs": [
    "src/apf/orchestrator_storage.py"
  ],
  "test_refs": [
    "tests/test_orchestrator_storage.py"
  ],
  "verification_test_ids": [
    "tests/test_orchestrator_storage.py::test_task_contract_canonical_round_trip"
  ],
  "reuse_constraints": [
    "Confirm the target still requires: audit ordering must reveal tampering",
    "Do not apply when: cryptographic non-repudiation requires an external signature service",
    "External Ethernian promotion signature remains mandatory"
  ],
  "applies_when": "audit ordering must reveal tampering",
  "not_when": "cryptographic non-repudiation requires an external signature service",
  "evidence_anchors": {
    "source_symbol": "OrchestratorStorageError",
    "test_name": "test_task_contract_canonical_round_trip"
  },
  "status": "ETHERNIAN_REVIEW_REQUIRED",
  "owned_asset": false,
  "semantic_fingerprint": "3c9662227b3680002be9a6abd281fc500773e39d6afd47a6b7171f32fe5bd772",
  "package_hash": "f284c959da37d13c8b980729374774e2123735dbe8b27a7a065c1436a2a2b17c"
}
