{
  "schema_version": "apf.pattern-candidate/1.0",
  "pattern_id": "apf.public.external-review-attestation",
  "version": "0.1.0",
  "title": "External Review Attestation",
  "intent": "Require externally signed and expiring review evidence for gated progress.",
  "problem": "Without Ed25519 decision binds candidate hash, policy, expiry and nonce, the system can accept an outcome that is not justified by the external review attestation contract.",
  "context": "This pattern addresses independent review is a required gate; its concrete control is Ed25519 decision binds candidate hash, policy, expiry and nonce.",
  "forces": [
    "Correctness requires that reviewer signature covers the exact candidate",
    "Operational pressure can cause: candidate changes after signing"
  ],
  "solution": "Implement Ed25519 decision binds candidate hash, policy, expiry and nonce. Verify the anchored symbol `AnalogReviewError` with `test_checked_in_candidates_produce_deterministic_immutable_packets` before reuse.",
  "invariants": [
    "reviewer signature covers the exact candidate",
    "expired or reused decisions never advance state"
  ],
  "failure_modes": [
    "candidate changes after signing",
    "worker possesses a reviewer signing key"
  ],
  "security": "The security boundary specifically rejects `candidate changes after signing` and fails closed if the external review attestation evidence cannot be verified.",
  "privacy": "For external review attestation, persist only its decision identifiers and digests; exclude payload data unrelated to Ed25519 decision binds candidate hash, policy, expiry and nonce.",
  "license_provenance": {
    "license": "INTERNAL_PROPRIETARY",
    "origin": "ARKAON_IMPLEMENTED_INTERNAL",
    "external_material_included": false
  },
  "evidence_hashes": {
    "src/apf/analog_review.py": "32ab849dbb1362a0ccf487cec7747b99b895c3295b437e84e3d812dfe5bc54be",
    "tests/test_analog_review.py": "77041d5b82eae78b306ee3d27f1aeabafc604b4fa05a870205afa432bd60ec81"
  },
  "source_refs": [
    "src/apf/analog_review.py"
  ],
  "test_refs": [
    "tests/test_analog_review.py"
  ],
  "verification_test_ids": [
    "tests/test_analog_review.py::test_checked_in_candidates_produce_deterministic_immutable_packets"
  ],
  "reuse_constraints": [
    "Confirm the target still requires: independent review is a required gate",
    "Do not apply when: automated low-risk validation is policy-authorized",
    "External Ethernian promotion signature remains mandatory"
  ],
  "applies_when": "independent review is a required gate",
  "not_when": "automated low-risk validation is policy-authorized",
  "evidence_anchors": {
    "source_symbol": "AnalogReviewError",
    "test_name": "test_checked_in_candidates_produce_deterministic_immutable_packets"
  },
  "status": "ETHERNIAN_REVIEW_REQUIRED",
  "owned_asset": false,
  "semantic_fingerprint": "051d27e45e4ed8643a5440562c189946509f09acf1bffe97183e59d71418a358",
  "package_hash": "19ba515734892edda82c47478839a7c15c42722bf5ecd40242f225d51346a31e"
}
