{
  "schema_version": "apf.pattern-candidate/1.0",
  "pattern_id": "apf.public.robots-policy-check",
  "version": "0.1.0",
  "title": "Robots Policy Check",
  "intent": "Evaluate declared crawl policy before retrieving public material.",
  "problem": "Without robots decision is recorded before a scheduled public fetch, the system can accept an outcome that is not justified by the robots policy check contract.",
  "context": "This pattern addresses automated public crawling is authorized; its concrete control is robots decision is recorded before a scheduled public fetch.",
  "forces": [
    "Correctness requires that denied paths are not requested",
    "Operational pressure can cause: stale robots data permits a newly denied path"
  ],
  "solution": "Implement robots decision is recorded before a scheduled public fetch. Verify the anchored symbol `StartupTrigger` with `test_default_plan_starts_at_boot_and_collects_immediately` before reuse.",
  "invariants": [
    "denied paths are not requested",
    "policy cache expiry triggers reevaluation"
  ],
  "failure_modes": [
    "stale robots data permits a newly denied path",
    "user-agent matching selects the wrong group"
  ],
  "security": "The security boundary specifically rejects `stale robots data permits a newly denied path` and fails closed if the robots policy check evidence cannot be verified.",
  "privacy": "For robots policy check, persist only its decision identifiers and digests; exclude payload data unrelated to robots decision is recorded before a scheduled public fetch.",
  "license_provenance": {
    "license": "INTERNAL_PROPRIETARY",
    "origin": "ARKAON_IMPLEMENTED_INTERNAL",
    "external_material_included": false
  },
  "evidence_hashes": {
    "src/apf/continuous_collection.py": "cf2362d17860538ad3a5c19ca12f049fc9288b690d2844e194060c1e0f9a0c78",
    "tests/test_continuous_collection.py": "d687b321d53abd3eec6f69928511c64c97e7ee2501642144f9c88968617a39be"
  },
  "source_refs": [
    "src/apf/continuous_collection.py"
  ],
  "test_refs": [
    "tests/test_continuous_collection.py"
  ],
  "verification_test_ids": [
    "tests/test_continuous_collection.py::test_default_plan_starts_at_boot_and_collects_immediately"
  ],
  "reuse_constraints": [
    "Confirm the target still requires: automated public crawling is authorized",
    "Do not apply when: the owner directly supplies the material",
    "External Ethernian promotion signature remains mandatory"
  ],
  "applies_when": "automated public crawling is authorized",
  "not_when": "the owner directly supplies the material",
  "evidence_anchors": {
    "source_symbol": "StartupTrigger",
    "test_name": "test_default_plan_starts_at_boot_and_collects_immediately"
  },
  "status": "ETHERNIAN_REVIEW_REQUIRED",
  "owned_asset": false,
  "semantic_fingerprint": "ca9f859d63d1cf7a43f1fee4338f1a664cabdbdc39ae6b7c5844c229fe41ddf4",
  "package_hash": "7ece3b3b1a63388d4592d0ccf4b5579f72959d7a7aa9dd416d90b173a3644745"
}
