{
  "schema_version": "apf.pattern-candidate/1.0",
  "pattern_id": "apf.public.repository-contract-parity",
  "version": "0.1.0",
  "title": "Repository Contract Parity",
  "intent": "Run one behavioral contract across memory and PostgreSQL repositories.",
  "problem": "Without one behavioral suite executes against memory and PostgreSQL adapters, the system can accept an outcome that is not justified by the repository contract parity contract.",
  "context": "This pattern addresses multiple persistence adapters implement one port; its concrete control is one behavioral suite executes against memory and PostgreSQL adapters.",
  "forces": [
    "Correctness requires that adapter-visible outcomes remain equivalent",
    "Operational pressure can cause: memory tests miss transaction behavior"
  ],
  "solution": "Implement one behavioral suite executes against memory and PostgreSQL adapters. Verify the anchored symbol `Base` with `test_upgrade_repository_contract_and_downgrade` before reuse.",
  "invariants": [
    "adapter-visible outcomes remain equivalent",
    "database-specific constraints strengthen rather than alter contracts"
  ],
  "failure_modes": [
    "memory tests miss transaction behavior",
    "SQL null or JSON semantics diverge"
  ],
  "security": "The security boundary specifically rejects `memory tests miss transaction behavior` and fails closed if the repository contract parity evidence cannot be verified.",
  "privacy": "For repository contract parity, persist only its decision identifiers and digests; exclude payload data unrelated to one behavioral suite executes against memory and PostgreSQL adapters.",
  "license_provenance": {
    "license": "INTERNAL_PROPRIETARY",
    "origin": "ARKAON_IMPLEMENTED_INTERNAL",
    "external_material_included": false
  },
  "evidence_hashes": {
    "src/apf/db.py": "4ea0b24765ded190b18d5bfbc425b156c9d4adc36cdbcdb29acd0ecd5be8f2f8",
    "tests/test_postgres_repository.py": "4b0406cd98d1c35af5046e3f918687c0bfde3a73bdbf9538f7bdcd5070b5f0a4"
  },
  "source_refs": [
    "src/apf/db.py"
  ],
  "test_refs": [
    "tests/test_postgres_repository.py"
  ],
  "verification_test_ids": [
    "tests/test_postgres_repository.py::test_upgrade_repository_contract_and_downgrade"
  ],
  "reuse_constraints": [
    "Confirm the target still requires: multiple persistence adapters implement one port",
    "Do not apply when: only one storage engine will ever exist",
    "External Ethernian promotion signature remains mandatory"
  ],
  "applies_when": "multiple persistence adapters implement one port",
  "not_when": "only one storage engine will ever exist",
  "evidence_anchors": {
    "source_symbol": "Base",
    "test_name": "test_upgrade_repository_contract_and_downgrade"
  },
  "status": "ETHERNIAN_REVIEW_REQUIRED",
  "owned_asset": false,
  "semantic_fingerprint": "ddaa331539d0f2ce9c881792c46a51d3733a58dd356fd54b6b4f7b538e5ed46d",
  "package_hash": "b4be694b9fc6ef399e1bc4e131fe201fa0d8f322b4a7d783430867bb099693bf"
}
