{
  "schema_version": "apf.pattern-candidate/1.0",
  "pattern_id": "apf.public.migration-roundtrip",
  "version": "0.1.0",
  "title": "Migration Roundtrip",
  "intent": "Verify schema upgrades and downgrades preserve declared database invariants.",
  "problem": "Without ordered upgrade and downgrade scripts are executed against schema invariants, the system can accept an outcome that is not justified by the migration roundtrip contract.",
  "context": "This pattern addresses versioned relational schema changes ship; its concrete control is ordered upgrade and downgrade scripts are executed against schema invariants.",
  "forces": [
    "Correctness requires that upgrade reaches the declared head once",
    "Operational pressure can cause: duplicate columns break fresh installs"
  ],
  "solution": "Implement ordered upgrade and downgrade scripts are executed against schema invariants. Verify the anchored symbol `migration_versions` with `test_every_upgrade_has_a_downgrade` before reuse.",
  "invariants": [
    "upgrade reaches the declared head once",
    "downgrade removes only revision-owned objects"
  ],
  "failure_modes": [
    "duplicate columns break fresh installs",
    "rollback destroys preexisting data structures"
  ],
  "security": "The security boundary specifically rejects `duplicate columns break fresh installs` and fails closed if the migration roundtrip evidence cannot be verified.",
  "privacy": "For migration roundtrip, persist only its decision identifiers and digests; exclude payload data unrelated to ordered upgrade and downgrade scripts are executed against schema invariants.",
  "license_provenance": {
    "license": "INTERNAL_PROPRIETARY",
    "origin": "ARKAON_IMPLEMENTED_INTERNAL",
    "external_material_included": false
  },
  "evidence_hashes": {
    "src/apf/migrations.py": "e6cbd2a7f92a1fc7ad94f97abcae803bb2c9fa15dc0b7c045aa5d7f01fe5c343",
    "tests/test_migrations.py": "340ef49cdb07adc19b64940fde9a17881b03afd1388c7ab672d1d7379e8968b4"
  },
  "source_refs": [
    "src/apf/migrations.py"
  ],
  "test_refs": [
    "tests/test_migrations.py"
  ],
  "verification_test_ids": [
    "tests/test_migrations.py::test_every_upgrade_has_a_downgrade"
  ],
  "reuse_constraints": [
    "Confirm the target still requires: versioned relational schema changes ship",
    "Do not apply when: storage is ephemeral and schemaless",
    "External Ethernian promotion signature remains mandatory"
  ],
  "applies_when": "versioned relational schema changes ship",
  "not_when": "storage is ephemeral and schemaless",
  "evidence_anchors": {
    "source_symbol": "migration_versions",
    "test_name": "test_every_upgrade_has_a_downgrade"
  },
  "status": "ETHERNIAN_REVIEW_REQUIRED",
  "owned_asset": false,
  "semantic_fingerprint": "ca50913d21c0a280479606840eede0e0b457a216803feaace611003f73c5e8c1",
  "package_hash": "632c1c05fae9f7f0b1d51b91667057119b528f4a7862822c5257d852a7137a43"
}
