{
  "schema_version": "apf.pattern-candidate/1.0",
  "pattern_id": "apf.public.secret-redaction-boundary",
  "version": "0.1.0",
  "title": "Secret Redaction Boundary",
  "intent": "Remove credentials and session material before analysis or persistence.",
  "problem": "Without structured header, query, storage and body redactors run before persistence, the system can accept an outcome that is not justified by the secret redaction boundary contract.",
  "context": "This pattern addresses developer artifacts can contain authentication material; its concrete control is structured header, query, storage and body redactors run before persistence.",
  "forces": [
    "Correctness requires that raw credentials never reach the evidence vault",
    "Operational pressure can cause: an uncommon token field escapes matching"
  ],
  "solution": "Implement structured header, query, storage and body redactors run before persistence. Verify the anchored symbol `MaterialError` with `test_authorized_rights_allow_licensed_reuse` before reuse.",
  "invariants": [
    "raw credentials never reach the evidence vault",
    "redaction markers reveal no secret value"
  ],
  "failure_modes": [
    "an uncommon token field escapes matching",
    "raw capture is logged before sanitization"
  ],
  "security": "The security boundary specifically rejects `an uncommon token field escapes matching` and fails closed if the secret redaction boundary evidence cannot be verified.",
  "privacy": "For secret redaction boundary, persist only its decision identifiers and digests; exclude payload data unrelated to structured header, query, storage and body redactors run before persistence.",
  "license_provenance": {
    "license": "INTERNAL_PROPRIETARY",
    "origin": "ARKAON_IMPLEMENTED_INTERNAL",
    "external_material_included": false
  },
  "evidence_hashes": {
    "src/apf/authorized_material.py": "009f1b79287f6f4b8d80b6ce77b3d7783521d316d39029e801f34c5e47b5d5ee",
    "tests/test_authorized_material.py": "8f654cbb7bb3efc121dabdceaff126f10735e5952e2922f76dcb8b3ecbf15468"
  },
  "source_refs": [
    "src/apf/authorized_material.py"
  ],
  "test_refs": [
    "tests/test_authorized_material.py"
  ],
  "verification_test_ids": [
    "tests/test_authorized_material.py::test_authorized_rights_allow_licensed_reuse"
  ],
  "reuse_constraints": [
    "Confirm the target still requires: developer artifacts can contain authentication material",
    "Do not apply when: the source format is proven incapable of carrying secrets",
    "External Ethernian promotion signature remains mandatory"
  ],
  "applies_when": "developer artifacts can contain authentication material",
  "not_when": "the source format is proven incapable of carrying secrets",
  "evidence_anchors": {
    "source_symbol": "MaterialError",
    "test_name": "test_authorized_rights_allow_licensed_reuse"
  },
  "status": "ETHERNIAN_REVIEW_REQUIRED",
  "owned_asset": false,
  "semantic_fingerprint": "5f0d1ce8840861ff2972cf5b435fd92c46452cc236314987871a54f51763ebaf",
  "package_hash": "4f44bf85753bb19ada996f0db5d001b0df1c17524dbd115aa836d7bdbcf1e81e"
}
